{
    "type": "bundle",
    "id": "bundle--9cd76699-3009-4e8c-b318-da5a77239106",
    "spec_version": "2.0",
    "objects": [
        {
            "object_marking_refs": [
                "marking-definition--fa42a846-8d90-4e51-bc29-71d5b4802168"
            ],
            "type": "malware",
            "name": "SharpStage",
            "x_mitre_aliases": [
                "SharpStage"
            ],
            "x_mitre_version": "1.1",
            "modified": "2021-08-18T23:48:44.783Z",
            "created": "2020-12-22T17:02:52.954Z",
            "x_mitre_platforms": [
                "Windows"
            ],
            "id": "malware--0ba9281c-93fa-4b29-8e9e-7ef918c7b13a",
            "description": "[SharpStage](https://attack.mitre.org/software/S0546) is a .NET malware with backdoor capabilities.(Citation: Cybereason Molerats Dec 2020)(Citation: BleepingComputer Molerats Dec 2020)",
            "labels": [
                "malware"
            ],
            "created_by_ref": "identity--c78cb6e5-0c4b-4611-8297-d1b8b55e40b5",
            "external_references": [
                {
                    "url": "https://attack.mitre.org/software/S0546",
                    "external_id": "S0546",
                    "source_name": "mitre-attack"
                },
                {
                    "description": "(Citation: Cybereason Molerats Dec 2020)(Citation: BleepingComputer Molerats Dec 2020)",
                    "source_name": "SharpStage"
                },
                {
                    "url": "https://www.cybereason.com/hubfs/dam/collateral/reports/Molerats-in-the-Cloud-New-Malware-Arsenal-Abuses-Cloud-Platforms-in-Middle-East-Espionage-Campaign.pdf",
                    "description": "Cybereason Nocturnus Team. (2020, December 9). MOLERATS IN THE CLOUD: New Malware Arsenal Abuses Cloud Platforms in Middle East Espionage Campaign. Retrieved December 22, 2020.",
                    "source_name": "Cybereason Molerats Dec 2020"
                },
                {
                    "url": "https://www.bleepingcomputer.com/news/security/hacking-group-s-new-malware-abuses-google-and-facebook-services/",
                    "description": "Ilascu, I. (2020, December 14). Hacking group\u2019s new malware abuses Google and Facebook services. Retrieved December 28, 2020.",
                    "source_name": "BleepingComputer Molerats Dec 2020"
                }
            ]
        }
    ]
}