{
    "type": "bundle",
    "id": "bundle--4e19536a-627f-4bee-a8b6-ea595915b650",
    "spec_version": "2.0",
    "objects": [
        {
            "type": "tool",
            "modified": "2021-04-25T23:30:38.375Z",
            "name": "RemoteUtilities",
            "x_mitre_aliases": [
                "RemoteUtilities"
            ],
            "x_mitre_version": "1.0",
            "created": "2021-03-18T14:57:34.628Z",
            "x_mitre_platforms": [
                "Windows"
            ],
            "id": "tool--03c6e0ea-96d3-4b23-9afb-05055663cf4b",
            "description": "[RemoteUtilities](https://attack.mitre.org/software/S0592) is a legitimate remote administration tool that has been used by [MuddyWater](https://attack.mitre.org/groups/G0069) since at least 2021 for execution on target machines.(Citation: Trend Micro Muddy Water March 2021)",
            "object_marking_refs": [
                "marking-definition--fa42a846-8d90-4e51-bc29-71d5b4802168"
            ],
            "labels": [
                "tool"
            ],
            "created_by_ref": "identity--c78cb6e5-0c4b-4611-8297-d1b8b55e40b5",
            "external_references": [
                {
                    "url": "https://attack.mitre.org/software/S0592",
                    "external_id": "S0592",
                    "source_name": "mitre-attack"
                },
                {
                    "url": "https://www.trendmicro.com/en_us/research/21/c/earth-vetala---muddywater-continues-to-target-organizations-in-t.html",
                    "description": "Peretz, A. and Theck, E. (2021, March 5). Earth Vetala \u2013 MuddyWater Continues to Target Organizations in the Middle East. Retrieved March 18, 2021.",
                    "source_name": "Trend Micro Muddy Water March 2021"
                }
            ]
        }
    ]
}